variable_weight,merchant_name,sku,type_of_barcode,barcode,product_name,brand_name,description,bullet_point_1,family,category,subcategory,unit_size,unit_of_measure,item_pack_quantity,total_eaches,max_order_quantity,main_image_url,other_image_url_1,other_image_url_2,other_image_url_3,pricing_strategy,minimum_order_amount,maximum_order_amount,average_size_per_merchant_uom,order_increment,sales,cumulative_sales_percentage
0,SE Grocers,004125875115,UPC,004125875115,Wyler's Instant Bouillon Chicken Cubes 3.25 Oz,Wyler's,Wyler's Instant Bouillon Chicken Cubes 3.25 Oz,Wyler's Instant Bouillon Chicken Cubes 3.25 Oz,GROCERY TOTAL,GROCERY,"SOUP, GROCERY",25,CT,1,1,20,https://s7d9.scene7.com/is/image/segrocers/00041258751153_A1C1,https://s7d9.scene7.com/is/image/segrocers/00041258751153_A1N1,https://s7d9.scene7.com/is/image/segrocers/00041258751153_A1L1,https://s7d9.scene7.com/is/image/segrocers/00041258751153_A1R1,,,,,,0.0,100.0
0,SE Grocers,085448700673,UPC,085448700673,Saffron Road Korean Chkn,Saffron Road,Saffron Road Korean Chkn,Saffron Road Korean Chkn,GROCERY TOTAL,FROZEN FOOD,FZ NATURAL ORGANIC,9,OZ,1,1,20,,,,,,,,,,0.0,100.0
0,SE Grocers,004133102151,UPC,004133102151,Goya Recaito Culantro Cooking Base 6 Ounces,Goya,Goya Recaito Culantro Cooking Base 6 Ounces,Goya Recaito Culantro Cooking Base 6 Ounces,GROCERY TOTAL,GROCERY,HISPANIC,6,OZ,1,1,20,,,,,,,,,,0.0,100.0
0,SE Grocers,006242800344,UPC,006242800344,Calypso Clips Metallic Sm,Calypso,Calypso Clips Metallic Sm,Calypso Clips Metallic Sm,GMD TOTAL,GMD,ETHNIC BEAUTY,1,EA,1,1,20,,,,,,,,,,0.0,100.0
0,SE Grocers,007453711410,UPC,007453711410,More Please Shrimp & Crab One Pot Tray 48 Oz,Carrington More Please,More Please Shrimp & Crab One Pot Tray 48 Oz,More Please Shrimp & Crab One Pot Tray 48 Oz,MARKET TOTAL,SEAFOOD,VALUE ADDED SEAFOOD,48,OZ,1,1,20,https://s7d9.scene7.com/is/image/segrocers/00074537114103_A1C1,https://s7d9.scene7.com/is/image/segrocers/00074537114103_A1N1,,,,,,,,1183.05,93.08
0,SE Grocers,085539500708,UPC,085539500708,Mooala Ban Nut Crmr,Mooala,Mooala Ban Nut Crmr,Mooala Ban Nut Crmr,GROCERY TOTAL,DAIRY,DAIRY NATURAL ORGANIC,16,OZ,1,1,20,https://s7d9.scene7.com/is/image/segrocers/00855395007086_A1C1,https://s7d9.scene7.com/is/image/segrocers/00855395007086_A1N1,https://s7d9.scene7.com/is/image/segrocers/00855395007086_A1L1,https://s7d9.scene7.com/is/image/segrocers/00855395007086_A1R1,,,,,,0.0,100.0
0,SE Grocers,004900002470,UPC,004900002470,"Sprite Lemon Lime Soda, 16 Ounce Bottle, 6 Pack",Sprite,"Sprite Lemon Lime Soda, 16 Ounce Bottle, 6 Pack","Sprite Lemon Lime Soda, 16 Ounce Bottle, 6 Pack",GROCERY TOTAL,GROCERY,SOFT DRINKS/MIXERS,.5,LT,1,1,20,https://s7d9.scene7.com/is/image/segrocers/00049000024708_A1C1,https://s7d9.scene7.com/is/image/segrocers/00049000024708_A1N1-2,https://s7d9.scene7.com/is/image/segrocers/00049000024708_A1L1-1,https://s7d9.scene7.com/is/image/segrocers/00049000024708_A1R1,,,,,,2798.22,56.69
0,SE Grocers,004169500217,UPC,004169500217,Braswell Preserves Fig,Braswell's,Braswell Preserves Fig,Braswell Preserves Fig,GROCERY TOTAL,GROCERY,NATURAL ORGANIC,11,OZ,1,1,20,,,,,,,,,,0.0,100.0
0,SE Grocers,007203003603,UPC,007203003603,Entenmanns Sprinkled Cook,,Entenmanns Sprinkled Cook,Entenmanns Sprinkled Cook,GROCERY TOTAL,GROCERY,SWEET GOODS,10,OZ,1,1,20,,,,,,,,,,0.0,100.0
0,SE Grocers,005527084475,UPC,005527084475,Grace Qk Ck Hominy,Grace,Grace Qk Ck Hominy,Grace Qk Ck Hominy,GROCERY TOTAL,GROCERY,HISPANIC,4.5,OZ,1,1,20,https://s7d9.scene7.com/is/image/segrocers/00055270844755_A1N1,,,,,,,,,0.0,100.0
0,SE Grocers,076866800012,UPC,076866800012,Bodek California Blend,Bodek,Bodek California Blend,Bodek California Blend,GROCERY TOTAL,FROZEN FOOD,FROZEN KOSHER,16,OZ,1,1,20,https://s7d9.scene7.com/is/image/segrocers/00768668000120_A1C1,,,,,,,,,0.0,100.0
0,SE Grocers,003700082458,UPC,003700082458,Bounty Select A Size,Bounty,Bounty Select A Size,Bounty Select A Size,GROCERY TOTAL,GROCERY,PAPER TOWELS,1,CT,1,1,20,https://s7d9.scene7.com/is/image/segrocers/00037000824589_A1N1,,,,,,,,,0.0,100.0
0,SE Grocers,004400003013,UPC,004400003013,Triscuit Dill Sea Salt An,Triscuit,Triscuit Dill Sea Salt An,Triscuit Dill Sea Salt An,GROCERY TOTAL,GROCERY,CRACKERS,9,OZ,1,1,20,https://s7d9.scene7.com/is/image/segrocers/00044000030131_A1N1,,,,,,,,,0.0,100.0
0,SE Grocers,074098588295,UPC,074098588295,"Clean Touch Multi-Surface Foam Sponge, For Everyday Cleaning 6 Pack",Clean Touch,"Clean Touch Multi-Surface Foam Sponge, For Everyday Cleaning 6 Pack","Clean Touch Multi-Surface Foam Sponge, For Everyday Cleaning 6 Pack",GMD TOTAL,GMD,GMD DOLLAR STORES,6,CT,1,1,20,https://s7d9.scene7.com/is/image/segrocers/00740985882955_A1C1,https://s7d9.scene7.com/is/image/segrocers/00740985882955_A1N1,,,,,,,,0.0,100.0
0,SE Grocers,007702887692,UPC,007702887692,Haddar Instant Chocolate,Haddar,Haddar Instant Chocolate,Haddar Instant Chocolate,GROCERY TOTAL,GROCERY,KOSHER FOODS,3.7,OZ,1,1,20,,,,,,,,,,0.0,100.0
0,SE Grocers,084024314766,UPC,084024314766,Blue Buffalo Nudges Jerky Cuts Chicken Natural Dog Treats 16 Ounces,Blue Buffalo,Blue Buffalo Nudges Jerky Cuts Chicken Natural Dog Treats 16 Ounces,Blue Buffalo Nudges Jerky Cuts Chicken Natural Dog Treats 16 Ounces,GROCERY TOTAL,GROCERY,PET FOOD,16,OZ,1,1,20,https://s7d9.scene7.com/is/image/segrocers/00840243147663_A1C1,https://s7d9.scene7.com/is/image/segrocers/00840243147663_A1N1,,,,,,,,0.0,100.0
0,SE Grocers,007391191365,UPC,007391191365,Tropez Nail Shell,Tropez,Tropez Nail Shell,Tropez Nail Shell,GMD TOTAL,GMD,COSMETICS,1,EA,1,1,5,,,,,,,,,,0.0,100.0
0,SE Grocers,084051510003,UPC,084051510003,Mrs Thinsters Cookie Thin,Thinsters,Mrs Thinsters Cookie Thin,Mrs Thinsters Cookie Thin,GROCERY TOTAL,GROCERY,NATURAL ORGANIC,4,OZ,1,1,20,https://s7d9.scene7.com/is/image/segrocers/00840515100037_A1N1,,,,,,,,,0.0,100.0
0,SE Grocers,001983630003,UPC,001983630003,Boing Tetra Guava,Boing!,Boing Tetra Guava,Boing Tetra Guava,GROCERY TOTAL,GROCERY,"JUICES SHLF STBL, MULT SRV",33,OZ,1,1,20,https://s7d9.scene7.com/is/image/segrocers/00019836300031_A1C1,,,,,,,,,0.0,100.0
0,SE Grocers,078000152401,UPC,078000152401,Canada Dry Ginger Ale 1 2,Canada Dry,Canada Dry Ginger Ale 1 2,Canada Dry Ginger Ale 1 2,GROCERY TOTAL,GROCERY,SOFT DRINKS/MIXERS,20,OZ,1,1,20,,,,,,,,,,0.0,100.0
0,SE Grocers,007116923526,UPC,007116923526,Betty Crocker White Baking Cups 100 Count,Betty Crocker,Betty Crocker White Baking Cups 100 Count,Betty Crocker White Baking Cups 100 Count,GROCERY TOTAL,GROCERY,BAKING DECORATIONS,100,CT,1,1,20,https://s7d9.scene7.com/is/image/segrocers/00071169235268_A1C1,https://s7d9.scene7.com/is/image/segrocers/00071169235268_A1N1,https://s7d9.scene7.com/is/image/segrocers/00071169235268_A1L1,https://s7d9.scene7.com/is/image/segrocers/00071169235268_A1R1,,,,,,86.16,7.65
0,SE Grocers,002950021252,UPC,002950021252,Nehi Grp Lg Neck,Nehi,Nehi Grp Lg Neck,Nehi Grp Lg Neck,GROCERY TOTAL,GROCERY,SOFT DRINKS/MIXERS,12,OZ,1,1,20,https://s7d9.scene7.com/is/image/segrocers/00029500212522_A1C1,,,,,,,,,0.0,100.0
0,SE Grocers,065858045387,UPC,065858045387,Ciego Montero Cola Soda 1.7 Liter,,Ciego Montero Cola Soda 1.7 Liter,Ciego Montero Cola Soda 1.7 Liter,GROCERY TOTAL,GROCERY,HISPANIC,1.7,LT,1,1,20,,,,,,,,,,0.0,100.0
0,SE Grocers,008680087272,UPC,008680087272,Neutrogena Beach Defense Water & Sun Spf70 Lotion Sunscreen 6.7 Ounces,Neutrogena,Neutrogena Beach Defense Water & Sun Spf70 Lotion Sunscreen 6.7 Ounces,Neutrogena Beach Defense Water & Sun Spf70 Lotion Sunscreen 6.7 Ounces,GMD TOTAL,GMD,SUNCARE,6.7,OZ,1,1,20,https://s7d9.scene7.com/is/image/segrocers/00086800872726_A1C1,https://s7d9.scene7.com/is/image/segrocers/00086800872726_A1N1,https://s7d9.scene7.com/is/image/segrocers/00086800872726_A1L1,https://s7d9.scene7.com/is/image/segrocers/00086800872726_A1R1,,,,,,62.45,21.51
0,SE Grocers,004200087604,UPC,004200087604,Quilted Northern Ultra Plush 18 Mega Rolls Bath Tissue,Quilted Northern Ultra Plush,Quilted Northern Ultra Plush 18 Mega Rolls Bath Tissue,Quilted Northern Ultra Plush 18 Mega Rolls Bath Tissue,GROCERY TOTAL,GROCERY,TOILET TISSUE,484,SF,1,1,5,https://s7d9.scene7.com/is/image/segrocers/00042000876049_A1C1,https://s7d9.scene7.com/is/image/segrocers/00042000876049_A1N1,,,,,,,,357.83,46.06
0,SE Grocers,085958100699,UPC,085958100699,Dove Men+Care Cream 2.53oz,Dove,Dove Men+Care Cream 2.53oz,Dove Men+Care Cream 2.53oz,GMD TOTAL,GMD,GMD DOLLAR STORES,2.5,OZ,1,1,20,https://s7d9.scene7.com/is/image/segrocers/00859581006990_A1C1,,,,,,,,,0.0,100.0
